{
  "$schema": "http://json-schema.org/draft-07/schema#",
  "title": "WabbleSpec Delivery Receipt",
  "description": "Schema for delivery receipts produced by archive.py. The permanent record of a completed task execution.",
  "type": "object",
  "required": ["task_id", "status", "version_previous", "version_new"],
  "properties": {
    "receipt_type": {
      "type": "string",
      "enum": ["delivery", "archive"],
      "description": "Receipt type identifier."
    },
    "task_id": {
      "type": "string",
      "description": "Task identifier this delivery receipt closes."
    },
    "session_id": {
      "type": "string",
      "description": "Session identifier."
    },
    "status": {
      "type": "string",
      "enum": ["PASS", "FAIL", "PARTIAL"],
      "description": "Overall delivery status."
    },
    "all_waves_passed": {
      "type": "boolean",
      "description": "True when every wave verifier returned PASS."
    },
    "waves_completed": {
      "type": "integer",
      "minimum": 0,
      "description": "Number of waves that completed."
    },
    "receipts_aggregated": {
      "type": ["integer", "array"],
      "description": "Count or list of receipts folded into this delivery."
    },
    "version_previous": {
      "type": "string",
      "description": "Semver string before this archive bump."
    },
    "version_new": {
      "type": "string",
      "description": "Semver string after this archive bump."
    },
    "version_bump_reason": {
      "type": "string",
      "enum": ["BREAKING", "ADDITIVE", "COSMETIC"],
      "description": "Highest delta_class found across session receipts."
    },
    "not_tested_items": {
      "type": "integer",
      "minimum": 0,
      "description": "Count of not_tested items aggregated from all receipts."
    },
    "not_tested_list": {
      "type": "array",
      "items": { "type": "string" },
      "description": "Deduplicated not_tested strings from all session receipts."
    },
    "summary": {
      "type": "string",
      "description": "Human-readable summary of what was delivered."
    },
    "archived_at": {
      "type": "string",
      "description": "ISO-8601 timestamp when archive.py ran."
    },
    "files_delivered": {
      "type": "array",
      "items": { "type": "string" },
      "description": "Files produced by this session."
    }
  },
  "additionalProperties": true
}
