{
  "receipt_type": "delivery",
  "task_id": "augment-executor-checkpoint-v1",
  "session_id": "augment-executor-checkpoint-v1",
  "status": "PASS",
  "all_waves_passed": true,
  "waves_completed": 1,
  "receipts_aggregated": 3,
  "version_previous": "0.17.0",
  "version_new": "0.18.0",
  "version_bump_reason": "ADDITIVE",
  "not_tested_items": 0,
  "not_tested_list": [],
  "summary": "Augment: executor-pre-wave-checkpoint-elimination-v1 experimental module complete",
  "archived_at": "2026-05-25T21:04:09Z",
  "files_delivered": [
    ".wabblespec/experiments/fixtures/executor-pre-wave-checkpoint-elimination-v1/golden.json"
  ]
}
